,section,path,text,lemma_text
0,.153a,https://www.perseus.tufts.edu/hopper/xmlchunk?doc=Perseus%3atext%3a1999.01.0175%3atext%3dCharm.%3Asection%3D153a,"ἥκομεν τῇ προτεραίᾳ ἑσπέρας ἐκ Ποτειδαίας ἀπὸ τοῦ στρατοπέδου, οἷον δὲ διὰ χρόνου ἀφιγμένος ἁσμένως ᾖα ἐπὶ τὰς συνήθεις διατριβάς. καὶ δὴ καὶ εἰς τὴν Ταυρέου παλαίστραν τὴν καταντικρὺ τοῦ τῆς Βασίλης ἱεροῦ εἰσῆλθον, καὶ αὐτόθι κατέλαβον πάνυ πολλούς, τοὺς μὲν καὶ ἀγνῶτας ἐμοί, τοὺς δὲ πλείστους γνωρίμους. καί με ὡς
","ἥκω προτεραῖος ἑσπέρα Ποτείδαια στρατόπεδον , οἷος χρόνος ἀφιγμένος ἁσμένος ᾖα συνήθης διατριβή . Ταυρέης παλαίστρα καταντικρὺ Βασίλης ἱερόν εἰσέρχομαι , αὐτόθι καταλαμβάνω πάνυ πολύς , ἀγνῶτας , πλεῖστος γνωρίμους . 
"
1,.153b,https://www.perseus.tufts.edu/hopper/xmlchunk?doc=Perseus%3atext%3a1999.01.0175%3atext%3dCharm.%3Asection%3D153b,"εἶδον εἰσιόντα ἐξ ἀπροσδοκήτου, εὐθὺς πόρρωθεν ἠσπάζοντο ἄλλος ἄλλοθεν: Χαιρεφῶν δέ, ἅτε καὶ μανικὸς ὤν, ἀναπηδήσας ἐκ μέσων ἔθει πρός με, καί μου λαβόμενος τῆς χειρός, ὦ Σώκρατες, ἦ δ᾽ ὅς, πῶς ἐσώθης ἐκ τῆς μάχης; Ὀλίγον δὲ πρὶν ἡμᾶς ἀπιέναι μάχη ἐγεγόνει ἐν τῇ Ποτειδαίᾳ, ἣν ἄρτι ἦσαν οἱ τῇδε πεπυσμένοι.καὶ ἐγὼ πρὸς αὐτὸν ἀποκρινόμενος, Οὑτωσί, ἔφην, ὡς σὺ ὁρᾷς.καὶ μὴν ἤγγελταί γε δεῦρο, ἔφη, ἥ τε μάχη πάνυ ἰσχυρὰ
","εἶδον εἰσιόντα ἀπροσδόκητος , εὐθύς πόρρωθεν ἀσπάζομαι ἄλλοθεν : Χαιρεφέω , ἅτε μανικός , ἀναπηδάω μέσος ἔθος , λαμβάνω χείρ , Σώκρατες , δέ , πῶς ἐσώθης μάχη ; ὀλίγος πρίν ἄπειμι μάχη ἐγεγόνει Ποτείδαια , ἄρτι πεπυσμένοι.καὶ ἀποκρινόμενος , οὑτωσί , φημί , ὁρᾷς.καὶ μήν ἤγγελταί δεῦρο , φημί , μάχη πάνυ ἰσχυρός 
"
2,.153c,https://www.perseus.tufts.edu/hopper/xmlchunk?doc=Perseus%3atext%3a1999.01.0175%3atext%3dCharm.%3Asection%3D153c,"γεγονέναι καὶ ἐν αὐτῇ πολλοὺς τῶν γνωρίμων τεθνάναι.καὶ ἐπιεικῶς, ἦν δ᾽ ἐγώ, ἀληθῆ ἀπήγγελται.παρεγένου μέν, ἦ δ᾽ ὅς, τῇ μάχῃ;παρεγενόμην.δεῦρο δή, ἔφη, καθεζόμενος ἡμῖν διήγησαι: οὐ γάρ τί πω πάντα σαφῶς πεπύσμεθα. καὶ ἅμα με καθίζει ἄγων παρὰ Κριτίαν τὸν Καλλαίσχρου.παρακαθεζόμενος οὖν ἠσπαζόμην τόν τε Κριτίαν καὶ τοὺς ἄλλους, καὶ διηγούμην αὐτοῖς τὰ ἀπὸ στρατοπέδου, ὅτι μέ
","γίγνομαι πολύς γνώριμος τεθνάναι.καὶ ἐπιεικής , δέ , ἀληθής ἀπήγγελται.παρεγένου , δέ , μάχῃ;παρεγενόμην.δεῦρο , φημί , καθέζομαι διήγηζω : πω πᾶς σαφής πεπύσμεθα . ἅμα καθίζω ἄγω Κριτίας Καλλαίσχρου.παρακαθεζόμενος ἠσπαζόμην Κριτίας , διηγούμην στρατόπεδον , 
"
3,.153d,https://www.perseus.tufts.edu/hopper/xmlchunk?doc=Perseus%3atext%3a1999.01.0175%3atext%3dCharm.%3Asection%3D153d,"τις ἀνέροιτο: ἠρώτων δὲ ἄλλος ἄλλο.ἐπειδὴ δὲ τῶν τοιούτων ἅδην εἴχομεν, αὖθις ἐγὼ αὐτοὺς ἀνηρώτων τὰ τῇδε, περὶ φιλοσοφίας ὅπως ἔχοι τὰ νῦν, περί τε τῶν νέων, εἴ τινες ἐν αὐτοῖς διαφέροντες ἢ σοφίᾳ ἢ κάλλει ἢ ἀμφοτέροις ἐγγεγονότες εἶεν. καὶ ὁ Κριτίας ἀποβλέψας
","ἀνέρω : ἐρωτάω ἄλλο.ἐπειδὴς ἅδην ἔχω , αὖθις ἀνηρώτων , φιλοσοφία ὅπως ἔχω νῦν , νέος , διαφέρω σοφία κάλλος ἀμφότερος ἐγγίγνομαι . κριτίας ἀποβλέπω 
"
4,.154a,https://www.perseus.tufts.edu/hopper/xmlchunk?doc=Perseus%3atext%3a1999.01.0175%3atext%3dCharm.%3Asection%3D154a,"πρὸς τὴν θύραν, ἰδών τινας νεανίσκους εἰσιόντας καὶ λοιδορουμένους ἀλλήλοις καὶ ἄλλον ὄχλον ὄπισθεν ἑπόμενον, περὶ μὲν τῶν καλῶν, ἔφη, ὦ Σώκρατες, αὐτίκα μοι δοκεῖς εἴσεσθαι: οὗτοι γὰρ τυγχάνουσιν οἱ εἰσιόντες πρόδρομοί τε καὶ ἐρασταὶ ὄντες τοῦ δοκοῦντος καλλίστου εἶναι τά γε δὴ νῦν, φαίνεται δέ μοι καὶ αὐτὸς ἐγγὺς ἤδη που εἶναι προσιών.ἔστιν δέ, ἦν δ᾽ ἐγώ, τίς τε καὶ τοῦ;οἶσθά που σύ γε, ἔφη, ἀλλ᾽ οὔπω ἐν ἡλικίᾳ ἦν πρίν σε
","θύρα , εἶδον νεανίσκος εἰσιόντας λοιδορέω ἀλλήλων ὄχλος ὄπισθεν ἑπόμενον , καλός , φημί , Σώκρατες , αὐτίκα δοκέω εἴσνεομαι : τυγχάνω εἰσιόντες πρόδρομος ἐραστής δοκέω καλλίστου νῦν , φαίνω ἐγγύς ἤδη πού προσιών.ἔστι , δέ , τοῦ;οἶσθά πού , φημί , ἀλλ᾽ οὔπω ἡλικία πρίν 
"
5,.154b,https://www.perseus.tufts.edu/hopper/xmlchunk?doc=Perseus%3atext%3a1999.01.0175%3atext%3dCharm.%3Asection%3D154b,"ἀπιέναι, Χαρμίδην τὸν τοῦ Γλαύκωνος τοῦ ἡμετέρου θείου ὑόν, ἐμὸν δὲ ἀνεψιόν.οἶδα μέντοι νὴ Δία, ἦν δ᾽ ἐγώ: οὐ γάρ τι φαῦλος οὐδὲ τότε ἦν ἔτι παῖς ὤν, νῦν δ᾽ οἶμαί που εὖ μάλα ἂν ἤδη μειράκιον εἴη.αὐτίκα, ἔφη, εἴσῃ καὶ ἡλίκος καὶ οἷος γέγονεν. καὶ ἅμα ταῦτ᾽ αὐτοῦ λέγοντος ὁ Χαρμίδης εἰσέρχεται.ἐμοὶ μὲν οὖν, ὦ ἑταῖρε, οὐδὲν σταθμητόν: ἀτεχνῶς γὰρ λευκὴ στάθμη εἰμὶ πρὸς τοὺς καλούς—σχεδὸν γάρ τί μοι πάντες οἱ ἐν τῇ ἡλικίᾳ καλοὶ φαίνονται—ἀτὰρ οὖν δὴ καὶ
","ἄπειμι , Χαρμίδης Γλαύκων ἡμέτερος θεῖος ὑός , ἀνεψιόν.οἶδα μέντοι νή ζεύς , δέ : φαῦλος τότε παῖς , νῦν δέ οἶμαι πού εὖ μάλα ἤδη μειράκιον εἴη.αὐτίκα , φημί , εἴσῃ ἡλίκος οἷος γίγνομαι . ἅμα ταῦτ᾽ λέγω Χαρμίδης εἰσέρχεται.ἐγώ , ἑταῖρος , σταθμητός : ἀτεχνός λευκός στάθμη καλός — σχεδόν πᾶς ἡλικία καλός φαίνω — ἀτάρ 
"
6,.154c,https://www.perseus.tufts.edu/hopper/xmlchunk?doc=Perseus%3atext%3a1999.01.0175%3atext%3dCharm.%3Asection%3D154c,"τότε ἐκεῖνος ἐμοὶ θαυμαστὸς ἐφάνη τό τε μέγεθος καὶ τὸ κάλλος, οἱ δὲ δὴ ἄλλοι πάντες ἐρᾶν ἔμοιγε ἐδόκουν αὐτοῦ— οὕτως ἐκπεπληγμένοι τε καὶ τεθορυβημένοι ἦσαν, ἡνίκ᾽ εἰσῄει—πολλοὶ δὲ δὴ ἄλλοι ἐρασταὶ καὶ ἐν τοῖς ὄπισθεν εἵποντο. καὶ τὸ μὲν ἡμέτερον τὸ τῶν ἀνδρῶν ἧττον θαυμαστὸν ἦν: ἀλλ᾽ ἐγὼ καὶ τοῖς παισὶ προσέσχον τὸν νοῦν, ὡς οὐδεὶς ἄλλοσ᾽ ἔβλεπεν αὐτῶν, οὐδ᾽ ὅστις σμικρότατος ἦν, ἀλλὰ πάντες ὥσπερ ἄγαλμα ἐθεῶντο αὐτόν. καὶ ὁ
","τότε ἐκεῖνος θαυμαστός φαίνω μέγεθος κάλλος , πᾶς ἐράω δοκέω — ἐκπεπληγμένοι τεθορυβημένοι , ἡνίκ᾽ εἴσειμι — πολύς ἐραστής ὄπισθεν ἕπομαι . ἡμέτερος ἀνήρ ἥσσων θαυμαστός : ἀλλ᾽ παῖς προσέχω νόος , ἄλλοσ᾽ βλέπω , οὐδέ σμικρότατος , πᾶς ὥσπερ ἄγαλμα θεάω . 
"
7,.154d,https://www.perseus.tufts.edu/hopper/xmlchunk?doc=Perseus%3atext%3a1999.01.0175%3atext%3dCharm.%3Asection%3D154d,"Χαιρεφῶν καλέσας με, τί σοι φαίνεται ὁ νεανίσκος, ἔφη, ὦ Σώκρατες; οὐκ εὐπρόσωπος;ὑπερφυῶς, ἦν δ᾽ ἐγώ.οὗτος μέντοι, ἔφη, εἰ ἐθέλοι ἀποδῦναι, δόξει σοι ἀπρόσωπος εἶναι: οὕτως τὸ εἶδος πάγκαλός ἐστιν.συνέφασαν οὖν καὶ οἱ ἄλλοι ταὐτὰ ταῦτα τῷ Χαιρεφῶντι: κἀγώ, Ἡράκλεις, ἔφην, ὡς ἄμαχον λέγετε τὸν ἄνδρα, εἰ ἔτι αὐτῷ ἓν δὴ μόνον τυγχάνει προσὸν σμικρόν τι.τί; ἔφη ὁ Κριτίας.
","Χαιρεφάω καλέω , φαίνω νεανίσκος , φημί , Σώκρατες ; εὐπρόσωπος;ὑπερφυῶς , δέ ἐγώ.οὗτος μέντοι , φημί , ἐθέλω ἀποδύω , δοκέω ἀπρόσωπος : εἶδος πάγκαλος ἐστιν.συνέφασαν Χαιρεφάω : ἐκἀ ἐγώ , Ἡράκλεις , φημί , ἄμαχος λέγω ἀνήρ , εἷς μόνος τυγχάνω προσὸν μικρός τι.τίς ; φημί κριτίας . 
"
8,.154e,https://www.perseus.tufts.edu/hopper/xmlchunk?doc=Perseus%3atext%3a1999.01.0175%3atext%3dCharm.%3Asection%3D154e,"εἰ τὴν ψυχήν, ἦν δ᾽ ἐγώ, τυγχάνει εὖ πεφυκώς. πρέπει δέ που, ὦ Κριτία, τοιοῦτον αὐτὸν εἶναι τῆς γε ὑμετέρας ὄντα οἰκίας.ἀλλ᾽, ἔφη, πάνυ καλὸς καὶ ἀγαθός ἐστιν καὶ ταῦτα.τί οὖν, ἔφην, οὐκ ἀπεδύσαμεν αὐτοῦ αὐτὸ τοῦτο καὶ ἐθεασάμεθα πρότερον τοῦ εἴδους; πάντως γάρ που τηλικοῦτος ὢν ἤδη ἐθέλει διαλέγεσθαι.καὶ πάνυ γε, ἔφη ὁ Κριτίας, ἐπεί τοι καὶ ἔστιν φιλόσοφός
","ψυχή , δέ , τυγχάνω εὖ πεφυκώς . πρέπω πού , Κριτίας , ὑμέτερος οἰκίας.ἀλλ᾽ , φημί , πάνυ καλός ἀγαθός ταῦτα.τί , φημί , ἀπεδύω θεάομαι πρότερος εἶδος ; πάντως πού τηλικοῦτος ἤδη ἐθέλω διαλέγεσθαι.καὶ πάνυ , φημί κριτίας , ἐπεί φιλόσοφός 
"
9,.155a,https://www.perseus.tufts.edu/hopper/xmlchunk?doc=Perseus%3atext%3a1999.01.0175%3atext%3dCharm.%3Asection%3D155a,"τε καί, ὡς δοκεῖ ἄλλοις τε καὶ ἑαυτῷ, πάνυ ποιητικός.τοῦτο μέν, ἦν δ᾽ ἐγώ, ὦ φίλε Κριτία, πόρρωθεν ὑμῖν τὸ καλὸν ὑπάρχει ἀπὸ τῆς Σόλωνος συγγενείας. ἀλλὰ τί οὐκ ἐπέδειξάς μοι τὸν νεανίαν καλέσας δεῦρο; οὐδὲ γὰρ ἄν που εἰ ἔτι ἐτύγχανε νεώτερος ὤν, αἰσχρὸν ἂν ἦν αὐτῷ διαλέγεσθαι ἡμῖν ἐναντίον γε σοῦ, ἐπιτρόπου τε ἅμα καὶ ἀνεψιοῦ ὄντος.ἀλλὰ καλῶς, ἔφη, λέγεις, καὶ καλοῦμεν αὐτόν. καὶ
",", δοκέω , πάνυ ποιητικός.τοῦτο , δέ , φίλος Κριτίας , πόρρωθεν καλός ὑπάρχω σόλων συγγένεια . ἐπέδειξάς νεανίας καλέω δεῦρο ; πού τυγχάνω νέος , αἰσχρός διαλέγω ἐναντίον , ἐπίτροπος ἅμα ἀνεψιός ὄντος.ἀλλὰ καλός , φημί , λέγω , καλέω . 
"
10,.155b,https://www.perseus.tufts.edu/hopper/xmlchunk?doc=Perseus%3atext%3a1999.01.0175%3atext%3dCharm.%3Asection%3D155b,"ἅμα πρὸς τὸν ἀκόλουθον, Παῖ, ἔφη, κάλει Χαρμίδην, εἰπὼν ὅτι βούλομαι αὐτὸν ἰατρῷ συστῆσαι περὶ τῆς ἀσθενείας ἧς πρῴην πρός με ἔλεγεν ὅτι ἀσθενοῖ. πρὸς οὖν ἐμὲ ὁ Κριτίας, Ἔναγχός τοι ἔφη βαρύνεσθαί τι τὴν κεφαλὴν ἕωθεν ἀνιστάμενος: ἀλλὰ τί σε κωλύει προσποιήσασθαι πρὸς αὐτὸν ἐπίστασθαί τι κεφαλῆς φάρμακον;οὐδέν, ἦν δ᾽ ἐγώ: μόνον ἐλθέτω.ἀλλ᾽ ἥξει, ἔφη.ὃ οὖν καὶ ἐγένετο. ἧκε γάρ, καὶ ἐποίησε γέλωτα
","ἅμα ἀκόλουθος , παῖς , φημί , καλέω Χαρμίδης , εἶπον βούλομαι ἰατρός συστῆζω ἀσθένεια πρῴην λέγω ἀσθενόω . κριτίας , Ἔναγχός φημί βαρύνω κεφαλή ἕωθεν ἀνίστημι : κωλύω προσποιέω ἐφίστημι κεφαλή φάρμακον;οὐδέν , δέ : μόνος ἐλθέτω.ἀλλ᾽ ἥκω , ἔφη.ὃ γίγνομαι . ἥκω , ποιέω γέλωτ 
"
11,.155c,https://www.perseus.tufts.edu/hopper/xmlchunk?doc=Perseus%3atext%3a1999.01.0175%3atext%3dCharm.%3Asection%3D155c,"πολύν: ἕκαστος γὰρ ἡμῶν τῶν καθημένων συγχωρῶν τὸν πλησίον ἐώθει σπουδῇ, ἵνα παρ᾽ αὑτῷ καθέζοιτο, ἕως τῶν ἐπ᾽ ἐσχάτῳ καθημένων τὸν μὲν ἀνεστήσαμεν, τὸν δὲ πλάγιον κατεβάλομεν. ὁ δ᾽ ἐλθὼν μεταξὺ ἐμοῦ τε καὶ τοῦ Κριτίου ἐκαθέζετο. ἐνταῦθα μέντοι, ὦ φίλε, ἐγὼ ἤδη ἠπόρουν, καί μου ἡ πρόσθεν θρασύτης ἐξεκέκοπτο, ἣν εἶχον ἐγὼ ὡς πάνυ ῥᾳδίως αὐτῷ διαλεξόμενος: ἐπειδὴ δέ, φράσαντος τοῦ Κριτίου ὅτι ἐγὼ εἴην ὁ τὸ φάρμακον ἐπιστάμενος, ἐνέβλεψέν τέ μοι
","πολύς : ἕκαστος κάθημαι συγχωρέω πλησίος ἐώθει σπουδή , ἵνα παρ᾽ καθέζω , ἕως ἐπ᾽ ἔσχατος κάθημαι ἀνεστήω , πλάγιος κατεβάλομεν . δέ ἔρχομαι μεταξύ Κριτίας καθέζομαι . ἐνταῦθα μέντοι , φίλος , ἤδη ἀπορέω , πρόσθεν θρασύτης ἐξεκέκοπτο , ἔχω πάνυ ῥᾴδιος διαλεξόμενος : ἐπεί , φράζω Κριτίας φάρμακον ἐπίσταμαι , ἐνέβλεψέν 
"
12,.155d,https://www.perseus.tufts.edu/hopper/xmlchunk?doc=Perseus%3atext%3a1999.01.0175%3atext%3dCharm.%3Asection%3D155d,"τοῖς ὀφθαλμοῖς ἀμήχανόν τι οἷον καὶ ἀνήγετο ὡς ἐρωτήσων, καὶ οἱ ἐν τῇ παλαίστρᾳ ἅπαντες περιέρρεον ἡμᾶς κύκλῳ κομιδῇ, τότε δή, ὦ γεννάδα, εἶδόν τε τὰ ἐντὸς τοῦ ἱματίου καὶ ἐφλεγόμην καὶ οὐκέτ᾽ ἐν ἐμαυτοῦ ἦν καὶ ἐνόμισα σοφώτατον εἶναι τὸν Κυδίαν τὰ ἐρωτικά, ὃς εἶπεν ἐπὶ καλοῦ λέγων παιδός, ἄλλῳ ὑποτιθέμενος, εὐλαβεῖσθαι μὴ κατέναντα λέοντος νεβρὸν ἐλθόντα μοῖραν αἱρεῖσθαι
","ὀφθαλμός ἀμήχανος οἷος ἀνάγω ἐρωτέω , παλαίστρα ἅπας περιρέω κύκλος κομιδῇ , τότε , γεννάδας , εἶδον ἐντός ἱμάτιον ἐφλέγω οὐκέτ᾽ ἐμαυτοῦ ἐνόμισα σόφος Κυδίας ἐρωτικός , λέγω καλός λέγω παῖς , ὑποτίθημι , εὐλαβέομαι κατέναντα λέων νεβρὸς ἔρχομαι μοῖρα αἱρέομαι 
"
13,.155e,https://www.perseus.tufts.edu/hopper/xmlchunk?doc=Perseus%3atext%3a1999.01.0175%3atext%3dCharm.%3Asection%3D155e,"κρεῶν: αὐτὸς γάρ μοι ἐδόκουν ὑπὸ τοῦ τοιούτου θρέμματος ἑαλωκέναι. ὅμως δὲ αὐτοῦ ἐρωτήσαντος εἰ ἐπισταίμην τὸ τῆς κεφαλῆς φάρμακον, μόγις πως ἀπεκρινάμην ὅτι ἐπισταίμην.τί οὖν, ἦ δ᾽ ὅς, ἐστίν;καὶ ἐγὼ εἶπον ὅτι αὐτὸ μὲν εἴη φύλλον τι, ἐπῳδὴ δέ τις ἐπὶ τῷ φαρμάκῳ εἴη, ἣν εἰ μέν τις ἐπᾴδοι ἅμα καὶ χρῷτο αὐτῷ, παντάπασιν ὑγιᾶ ποιοῖ τὸ φάρμακον: ἄνευ δὲ τῆς ἐπῳδῆς οὐδὲν ὄφελος εἴη τοῦ φύλλου.
","κρέας : δοκέω θρέμματος ἑαλωκέναι . ὅμως ἐρωτέω ἐπισίαματ κεφαλή φάρμακον , μόγις οὔπως ἀπεκρινάμην ἐπισταίμην.τί , δέ , ἐστίν;καί εἶπον φύλλον , ἐπῳδὴς φάρμακον , ἐπᾴδω ἅμα χρμαῷ , παντάπασι ὑγιᾶ ποιόω φάρμακον : ἄνευ ἐπῳδῆς ὄφελος φύλλον . 
"
14,.156a,https://www.perseus.tufts.edu/hopper/xmlchunk?doc=Perseus%3atext%3a1999.01.0175%3atext%3dCharm.%3Asection%3D156a,"καὶ ὅς, Ἀπογράψομαι τοίνυν, ἔφη, παρὰ σοῦ τὴν ἐπῳδήν.πότερον, ἦν δ᾽ ἐγώ, ἐάν με πείθῃς ἢ κἂν μή;γελάσας οὖν, ἐάν σε πείθω, ἔφη, ὦ Σώκρατες.εἶεν, ἦν δ᾽ ἐγώ: καὶ τοὔνομά μου σὺ ἀκριβοῖς;εἰ μὴ ἀδικῶ γε, ἔφη: οὐ γάρ τι σοῦ ὀλίγος λόγος ἐστὶν ἐν τοῖς ἡμετέροις ἡλικιώταις, μέμνημαι δὲ ἔγωγε καὶ παῖς ὢν Κριτίᾳ τῷδε συνόντα σε.καλῶς γε σύ, ἦν δ᾽ ἐγώ, ποιῶν: μᾶλλον γάρ σοι παρρησιάσομαι
",", Ἀπογράπτω τοίνυν , φημί , ἐπῳδήν.πότερος , δέ , πείθω μή;γελάω , πείθω , φημί , Σώκρατες.εἶεν , δέ : τοὔνομα ἀκριβοῖς;εἰ ἀδικέω , φημί : ὀλίγος λόγος ἡμέτερος ἡλικιώτης , μιμνήσκω παῖς Κριτία συνόντα σε.καλῶς , δέ , ποιέω : μᾶλλον παρρησιάω 
"
15,.156b,https://www.perseus.tufts.edu/hopper/xmlchunk?doc=Perseus%3atext%3a1999.01.0175%3atext%3dCharm.%3Asection%3D156b,"περὶ τῆς ἐπῳδῆς οἵα τυγχάνει οὖσα: ἄρτι δ᾽ ἠπόρουν τίνι τρόπῳ σοι ἐνδειξαίμην τὴν δύναμιν αὐτῆς. ἔστι γάρ, ὦ Χαρμίδη, τοιαύτη οἵα μὴ δύνασθαι τὴν κεφαλὴν μόνον ὑγιᾶ ποιεῖν, ἀλλ᾽ ὥσπερ ἴσως ἤδη καὶ σὺ ἀκήκοας τῶν ἀγαθῶν ἰατρῶν, ἐπειδάν τις αὐτοῖς προσέλθῃ τοὺς ὀφθαλμοὺς ἀλγῶν, λέγουσί που ὅτι οὐχ οἷόν τε αὐτοὺς μόνους ἐπιχειρεῖν τοὺς ὀφθαλμοὺς ἰᾶσθαι, ἀλλ᾽ ἀναγκαῖον εἴη ἅμα καὶ τὴν κεφαλὴν θεραπεύειν, εἰ μέλλοι
","ἐπῳδῆς οἷος τυγχάνω : ἄρτι δέ ἀπορέω τρόπος ἐνδειξαίμην δύναμις . , Χαρμίδης , οἷος δύναμαι κεφαλή μόνος ὑγιᾶ ποιέω , ἀλλ᾽ ὥσπερ ἴσως ἤδη ἀκούω ἀγαθός ἰατρός , ἐπειδάν προσέρχομαι ὀφθαλμός ἀλγέω , λέγω πού οἷος μόνος ἐπιχειρέω ὀφθαλμός ἰάομαι , ἀλλ᾽ ἀναγκαῖος ἅμα κεφαλή θεραπεύω , μέλλω 
"
16,.156c,https://www.perseus.tufts.edu/hopper/xmlchunk?doc=Perseus%3atext%3a1999.01.0175%3atext%3dCharm.%3Asection%3D156c,"καὶ τὰ τῶν ὀμμάτων εὖ ἔχειν: καὶ αὖ τὸ τὴν κεφαλὴν οἴεσθαι ἄν ποτε θεραπεῦσαι αὐτὴν ἐφ᾽ ἑαυτῆς ἄνευ ὅλου τοῦ σώματος πολλὴν ἄνοιαν εἶναι. ἐκ δὴ τούτου τοῦ λόγου διαίταις ἐπὶ πᾶν τὸ σῶμα τρεπόμενοι μετὰ τοῦ ὅλου τὸ μέρος ἐπιχειροῦσιν θεραπεύειν τε καὶ ἰᾶσθαι: ἢ οὐκ ᾔσθησαι ὅτι ταῦτα οὕτως λέγουσίν τε καὶ ἔχει;πάνυ γε, ἔφη.οὐκοῦν καλῶς σοι δοκεῖ λέγεσθαι καὶ ἀποδέχῃ τὸν λόγον;πάντων μάλιστα, ἔφη.
","ὄμμα εὖ ἔχω : αὖ κεφαλή οἴομαι ποτε θεραπεύω ἐφ᾽ ἄνευ ὅλος σῶμα πολύς ἄνοια . λόγος διαίτα πᾶς σῶμα τρέπω ὅλος μέρος ἐπιχειρέω θεραπεύω ἰάομαι : ᾔσθησαι λέγω ἔχει;πάνυ , ἔφη.οὐκοῦν καλός δοκέω λέγω ἀποδέχομαι λόγον;πάντως μάλιστα , φημί . 
"
17,.156d,https://www.perseus.tufts.edu/hopper/xmlchunk?doc=Perseus%3atext%3a1999.01.0175%3atext%3dCharm.%3Asection%3D156d,"κἀγὼ ἀκούσας αὐτοῦ ἐπαινέσαντος ἀνεθάρρησά τε, καί μοι κατὰ σμικρὸν πάλιν ἡ θρασύτης συνηγείρετο, καὶ ἀνεζωπυρούμην. καὶ εἶπον: τοιοῦτον τοίνυν ἐστίν, ὦ Χαρμίδη, καὶ τὸ ταύτης τῆς ἐπῳδῆς. ἔμαθον δ᾽ αὐτὴν ἐγὼ ἐκεῖ ἐπὶ στρατιᾶς παρά τινος τῶν Θρᾳκῶν τῶν Ζαλμόξιδος ἰατρῶν, οἳ λέγονται καὶ ἀπαθανατίζειν. ἔλεγεν δὲ ὁ Θρᾲξ οὗτος ὅτι ταῦτα μὲν ἰατροὶ οἱ Ἕλληνες, ἃ νυνδὴ ἐγὼ ἔλεγον, καλῶς λέγοιεν: ἀλλὰ Ζάλμοξις, ἔφη, λέγει ὁ ἡμέτερος βασιλεύς, θεὸς ὤν,
","ἐκἀ ἐγὼ ἀκούω ἐπαινέω ἀνεθάρρησά , μικρός πάλιν θρασύτης συνηγείρετο , ἀνεζωπυρούμην . εἶπον : τοίνυν , Χαρμίδη , ἐπῳδῆς . μανθάνω δέ ἐκεῖ στρατιά θρᾷξ Ζαλμόξις ἰατρός , λέγω ἀπαθανατίζω . λέγω Θρᾲξ ἰατρός ἕλλην , νυνδὴ λέγω , καλός λέγω : Ζάλμοξις , φημί , λέγω ἡμέτερος βασιλεύς , θεός , 
"
