,section,path,text,lemma_text
53,.163e,https://www.perseus.tufts.edu/hopper/xmlchunk?doc=Perseus%3atext%3a1999.01.0175%3atext%3dCharm.%3Asection%3D163e,"ἆρα τὴν τῶν ἀγαθῶν πρᾶξιν ἢ ποίησιν ἢ ὅπως σὺ βούλει ὀνομάζειν, ταύτην λέγεις σὺ σωφροσύνην εἶναι;ἔγωγε, ἔφη.οὐκ ἄρα σωφρονεῖ ὁ τὰ κακὰ πράττων, ἀλλ᾽ ὁ τἀγαθά;σοὶ δέ, ἦ δ᾽ ὅς, ὦ βέλτιστε, οὐχ οὕτω δοκεῖ;ἔα, ἦν δ᾽ ἐγώ: μὴ γάρ πω τὸ ἐμοὶ δοκοῦν σκοπῶμεν, ἀλλ᾽ ὃ σὺ λέγεις νῦν.ἀλλὰ μέντοι ἔγωγε, ἔφη, τὸν μὴ ἀγαθὰ ἀλλὰ κακὰ ποιοῦντα οὔ φημι σωφρονεῖν, τὸν δὲ ἀγαθὰ ἀλλὰ μὴ κακὰ σωφρονεῖν: τὴν γὰρ τῶν ἀγαθῶν πρᾶξιν σωφροσύνην εἶναι σαφῶς σοι διορίζομαι.
","ἆρα ἀγαθός πρᾶξις ποίησις ὅπως βούλομαι ὀνομάζω , λέγω σωφροσύνη εἶναι;ἔγωγε , ἔφη.οὐκ σωφρονέω κακός πράττω , ἀλλ᾽ τἀγαθά;σοὶ , δέ , βέλτιστος , δοκεῖ;ἔα , δέ : πω δοκέω σκοπέω , ἀλλ᾽ λέγω νῦν.ἀλλὰ μέντοι , φημί , ἀγαθός κακός ποιέω φημί σωφρονέω , ἀγαθός κακός σωφρονέω : ἀγαθός πρᾶξις σωφροσύνη σαφής διορίζω . 
"
54,.164a,https://www.perseus.tufts.edu/hopper/xmlchunk?doc=Perseus%3atext%3a1999.01.0175%3atext%3dCharm.%3Asection%3D164a,"καὶ οὐδέν γέ σε ἴσως κωλύει ἀληθῆ λέγειν: τόδε γε μέντοι, ἦν δ᾽ ἐγώ, θαυμάζω, εἰ σωφρονοῦντας ἀνθρώπους ἡγῇ σὺ ἀγνοεῖν ὅτι σωφρονοῦσιν.ἀλλ᾽ οὐχ ἡγοῦμαι, ἔφη.οὐκ ὀλίγον πρότερον, ἔφην ἐγώ, ἐλέγετο ὑπὸ σοῦ ὅτι τοὺς δημιουργοὺς οὐδὲν κωλύει καὶ αὖ τὰ τῶν ἄλλων ποιοῦντας σωφρονεῖν;ἐλέγετο γάρ, ἔφη: ἀλλὰ τί τοῦτο;οὐδέν: ἀλλὰ λέγε εἰ δοκεῖ τίς σοι ἰατρός, ὑγιᾶ τινα
","ἴσως κωλύω ἀληθής λέγω : μέντοι , δέ , θαυμάζω , σωφρονέω ἄνθρωπος ἡγῇμι ἀγνοέω σωφρονοῦσιν.ἀλλ᾽ ἡγέομαι , ἔφη.οὐκ ὀλίγος πρότερος , φημί , λέγω δημιουργοὺς κωλύω αὖ ποιέω σωφρονεῖν;ἐλέγετο , φημί : τοῦτο;οὐδείς : λέγω δοκέω ἰατρός , ὑγιᾶ 
"
55,.164b,https://www.perseus.tufts.edu/hopper/xmlchunk?doc=Perseus%3atext%3a1999.01.0175%3atext%3dCharm.%3Asection%3D164b,"ποιῶν, ὠφέλιμα καὶ ἑαυτῷ ποιεῖν καὶ ἐκείνῳ ὃν ἰῷτο;ἔμοιγε.οὐκοῦν τὰ δέοντα πράττει ὅ γε ταῦτα πράττων;ναί.ὁ τὰ δέοντα πράττων οὐ σωφρονεῖ;σωφρονεῖ μὲν οὖν.ἦ οὖν καὶ γιγνώσκειν ἀνάγκη τῷ ἰατρῷ ὅταν τε ὠφελίμως ἰᾶται καὶ ὅταν μή; καὶ ἑκάστῳ τῶν δημιουργῶν ὅταν τε μέλλῃ ὀνήσεσθαι ἀπὸ τοῦ ἔργου οὗ ἂν πράττῃ καὶ ὅταν μή;ἴσως οὔ.ἐνίοτε ἄρα, ἦν δ᾽ ἐγώ, ὠφελίμως πράξας ἢ βλαβερῶς ὁ
","ποιέω , ὠφέλιμος ποιέω ἐκεῖνος ἰῷτο;ἔμοιγε.οὐκοῦν δέω πράττω πράττων;ναί.ὁ δέω πράττω σωφρονεῖ;σωφρονέω οὖν.ἦ γιγνώσκω ἀνάγκη ἰατρός ὅταν ὠφελίμος ἰάω ὅταν ; ἕκαστος δημιουργῶν ὅταν μέλλω ὀνέω ἔργον πράττω ὅταν μή;ἴσως οὔ.ἐνίοτε , δέ , ὠφελίμως πράσσω βλαβερός 
"
56,.164c,https://www.perseus.tufts.edu/hopper/xmlchunk?doc=Perseus%3atext%3a1999.01.0175%3atext%3dCharm.%3Asection%3D164c,"ἰατρὸς οὐ γιγνώσκει ἑαυτὸν ὡς ἔπραξεν: καίτοι ὠφελίμως πράξας, ὡς ὁ σὸς λόγος, σωφρόνως ἔπραξεν. ἢ οὐχ οὕτως ἔλεγες;ἔγωγε.οὐκοῦν, ὡς ἔοικεν, ἐνίοτε ὠφελίμως πράξας πράττει μὲν σωφρόνως καὶ σωφρονεῖ, ἀγνοεῖ δ᾽ ἑαυτὸν ὅτι σωφρονεῖ;ἀλλὰ τοῦτο μέν, ἔφη, ὦ Σώκρατες, οὐκ ἄν ποτε γένοιτο, ἀλλ᾽ εἴ τι σὺ οἴει ἐκ τῶν ἔμπροσθεν ὑπ᾽ ἐμοῦ ὡμολογημένων εἰς τοῦτο ἀναγκαῖον εἶναι συμβαίνειν, ἐκείνων ἄν τι ἔγωγε
","ἰατρός γιγνώσκω πράσσω : καίτοι ὠφελίμως πράσσω , λόγος , σώφρων πράσσω . ἔλεγες;ἔγωγε.οὐκοῦν , ἔοικα , ἐνίοτε ὠφελίμως πράσσω πράττω σώφρων σωφρονέω , ἀγνοέω δέ σωφρονεῖ;ἀλλὰ , φημί , Σώκρατες , ποτε γίγνομαι , ἀλλ᾽ οἴομαι ἔμπροσθεν ὑπ᾽ ὡμολογέω ἀναγκαῖος συμβαίνω , ἐκεῖνος 
"
57,.164d,https://www.perseus.tufts.edu/hopper/xmlchunk?doc=Perseus%3atext%3a1999.01.0175%3atext%3dCharm.%3Asection%3D164d,"μᾶλλον ἀναθείμην, καὶ οὐκ ἂν αἰσχυνθείην μὴ οὐχὶ ὀρθῶς φάναι εἰρηκέναι, μᾶλλον ἤ ποτε συγχωρήσαιμ᾽ ἂν ἀγνοοῦντα αὐτὸν ἑαυτὸν ἄνθρωπον σωφρονεῖν. σχεδὸν γάρ τι ἔγωγε αὐτὸ τοῦτό φημι εἶναι σωφροσύνην, τὸ γιγνώσκειν ἑαυτόν, καὶ συμφέρομαι τῷ ἐν Δελφοῖς ἀναθέντι τὸ τοιοῦτον γράμμα. καὶ γὰρ τοῦτο οὕτω μοι δοκεῖ τὸ γράμμα ἀνακεῖσθαι, ὡς δὴ πρόσρησις οὖσα τοῦ θεοῦ τῶν εἰσιόντων ἀντὶ τοῦ χαῖρε, ὡς
","μᾶλλον ἀναθείμην , αἰσχυνθείην ὀρθός φημί λέγω , μᾶλλον ποτε συγχωρήσαιμ᾽ ἀγνοέω ἄνθρωπος σωφρονέω . σχεδόν φημί σωφροσύνη , γιγνώσκω ἑαυτοῦ , συμφέρω δελφοί ἀνατίθημι γράμμα . δοκέω γράμμα ἀνακέομαι , πρόσρησις θεός εἴσειμι ἀντί χαίρω , 
"
58,.164e,https://www.perseus.tufts.edu/hopper/xmlchunk?doc=Perseus%3atext%3a1999.01.0175%3atext%3dCharm.%3Asection%3D164e,"τούτου μὲν οὐκ ὀρθοῦ ὄντος τοῦ προσρήματος, τοῦ χαίρειν, οὐδὲ δεῖν τοῦτο παρακελεύεσθαι ἀλλήλοις ἀλλὰ σωφρονεῖν. οὕτω μὲν δὴ ὁ θεὸς προσαγορεύει τοὺς εἰσιόντας εἰς τὸ ἱερὸν διαφέρον τι ἢ οἱ ἄνθρωποι, ὡς διανοούμενος ἀνέθηκεν ὁ ἀναθείς, ὥς μοι δοκεῖ: καὶ λέγει πρὸς τὸν ἀεὶ εἰσιόντα οὐκ ἄλλο τι ἢ Σωφρόνει, φησίν. αἰνιγματωδέστερον δὲ δή, ὡς μάντις, λέγει: τὸ γὰρ Γνῶθι σαυτόν καὶ τὸ Σωφρόνει ἔστιν
","ὀρθός προσρήματος , χαίρω , δεῖ παρακελεύομαι ἀλλήλων σωφρονέω . θεός προσαγορεύω εἰσιόντας ἱερόν διαφέρος ἄνθρωπος , διανοέομαι ἀνατίθημι ἀνατίθημι , δοκέω : λέγω ἀεί εἰσιόντα Σωφρόνω , φημί . αἰνιγματωδής , μάντις , λέγω : γιγνώσκω σαυτοῦ Σωφρόνω 
"
59,.165a,https://www.perseus.tufts.edu/hopper/xmlchunk?doc=Perseus%3atext%3a1999.01.0175%3atext%3dCharm.%3Asection%3D165a,"μὲν ταὐτόν, ὡς τὰ γράμματά φησιν καὶ ἐγώ, τάχα δ᾽ ἄν τις οἰηθείη ἄλλο εἶναι, ὃ δή μοι δοκοῦσιν παθεῖν καὶ οἱ τὰ ὕστερον γράμματα ἀναθέντες, τό τε μηδὲν ἄγαν καὶ τὸ Ἐγγύη πάρα δ᾽ ἄτη. καὶ γὰρ οὗτοι συμβουλὴν ᾠήθησαν εἶναι τὸ Γνῶθι σαυτόν, ἀλλ᾽ οὐ τῶν εἰσιόντων ἕνεκεν ὑπὸ τοῦ θεοῦ πρόσρησιν: εἶθ᾽ ἵνα δὴ καὶ σφεῖς μηδὲν ἧττον συμβουλὰς χρησίμους ἀναθεῖεν, ταῦτα γράψαντες ἀνέθεσαν. οὗ δὴ οὖν ἕνεκα λέγω, ὦ Σώκρατες, ταῦτα πάντα, τόδ᾽ ἐστίν: τὰ μὲν
","ταὐτός , γράμματά φημί , τάχα δέ οἰηθείη , δοκέω πάσχω ὕστερος γράμμα ἀνατίθημι , μηδείς ἄγαν Ἐγγύης δέ ἄτη . συμβουλή ᾠήθησαν γιγνώσκω σαυτοῦ , ἀλλ᾽ εἴσειμι ἕνεκα θεός πρόσρησις : εἶθ᾽ ἵνα σφεῖς μηδείς ἥσσων συμβουλὰ χρησίμους ἀναθεῖεν , γράφω ἀνατίθημι . ἕνεκα λέγω , Σώκρατες , πᾶς , ὅδε : 
"
60,.165b,https://www.perseus.tufts.edu/hopper/xmlchunk?doc=Perseus%3atext%3a1999.01.0175%3atext%3dCharm.%3Asection%3D165b,"ἔμπροσθέν σοι πάντα ἀφίημι—ἴσως μὲν γάρ τι σὺ ἔλεγες περὶ αὐτῶν ὀρθότερον, ἴσως δ᾽ ἐγώ, σαφὲς δ᾽ οὐδὲν πάνυ ἦν ὧν ἐλέγομεν—νῦν δ᾽ ἐθέλω τούτου σοι διδόναι λόγον, εἰ μὴ ὁμολογεῖς σωφροσύνην εἶναι τὸ γιγνώσκειν αὐτὸν ἑαυτόν.ἀλλ᾽, ἦν δ᾽ ἐγώ, ὦ Κριτία, σὺ μὲν ὡς φάσκοντος ἐμοῦ εἰδέναι περὶ ὧν ἐρωτῶ προσφέρῃ πρός με, καὶ ἐὰν δὴ βούλωμαι, ὁμολογήσοντός σοι: τὸ δ᾽ οὐχ οὕτως ἔχει, ἀλλὰ ζητῶ γὰρ μετὰ σοῦ ἀεὶ τὸ προτιθέμενον διὰ τὸ μὴ αὐτὸς
","ἔμπροσθεν πᾶς ἀφίημι — ἴσως λεγεμί ὀρθός , ἴσως δέ , σαφής δέ πάνυ ἐλέγω — νῦν δέ ἐθέλω δίδωμι λόγος , ὁμολογέω σωφροσύνη γιγνώσκω ἑαυτόν.ἀλλ᾽ , δέ , Κριτία , φάσκω οἶδα ἐρωτάω προσφέρω , βούλομαι , ὁμολογήσοντός : δέ ἔχω , ζητέω ἀεί προτίθημι 
"
61,.165c,https://www.perseus.tufts.edu/hopper/xmlchunk?doc=Perseus%3atext%3a1999.01.0175%3atext%3dCharm.%3Asection%3D165c,"εἰδέναι. σκεψάμενος οὖν ἐθέλω εἰπεῖν εἴτε ὁμολογῶ εἴτε μή. ἀλλ᾽ ἐπίσχες ἕως ἂν σκέψωμαι.σκόπει δή, ἦ δ᾽ ὅς.καὶ γάρ, ἦν δ᾽ ἐγώ, σκοπῶ. εἰ γὰρ δὴ γιγνώσκειν γέ τί ἐστιν ἡ σωφροσύνη, δῆλον ὅτι ἐπιστήμη τις ἂν εἴη καὶ τινός: ἢ οὔ;ἔστιν, ἔφη, ἑαυτοῦ γε.οὐκοῦν καὶ ἰατρική, ἔφην, ἐπιστήμη ἐστὶν τοῦ ὑγιεινοῦ;πάνυ γε.εἰ τοίνυν με, ἔφην, ἔροιο σύ: ἰατρικὴ ὑγιεινοῦ ἐπιστήμη οὖσα τί ἡμῖν χρησίμη ἐστὶν καὶ τί ἀπεργάζεται,
","οἶδα . σκέπω ἐθέλω εἶπον εἴτε ὁμολογέω εἴτε . ἀλλ᾽ ἐπίσχες ἕως σκέψωμαι.σκόπει , δέ ὅς.καὶ , δέ , σκοπέω . γιγνώσκω σωφροσύνη , δῆλος ἐπιστήμη : οὔ;ἔστιν , φημί , γε.οὐκοῦν ἰατρική , φημί , ἐπιστήμη ὑγιεινοῦ;πάνυ γε.εἰ τοίνυν , φημί , ἔρομαι : ἰατρικὴ ὑγιεινός ἐπιστήμη χρησίμος ἀπεργάζομαι , 
"
62,.165d,https://www.perseus.tufts.edu/hopper/xmlchunk?doc=Perseus%3atext%3a1999.01.0175%3atext%3dCharm.%3Asection%3D165d,"εἴποιμ᾽ ἂν ὅτι οὐ σμικρὰν ὠφελίαν: τὴν γὰρ ὑγίειαν καλὸν ἡμῖν ἔργον ἀπεργάζεται, εἰ ἀποδέχῃ τοῦτο.ἀποδέχομαι.καὶ εἰ τοίνυν με ἔροιο τὴν οἰκοδομικήν, ἐπιστήμην οὖσαν τοῦ οἰκοδομεῖν, τί φημι ἔργον ἀπεργάζεσθαι, εἴποιμ᾽ ἂν ὅτι οἰκήσεις: ὡσαύτως δὲ καὶ τῶν ἄλλων τεχνῶν. χρὴ οὖν καὶ σὲ ὑπὲρ τῆς σωφροσύνης, ἐπειδὴ φῂς αὐτὴν ἑαυτοῦ ἐπιστήμην εἶναι, ἔχειν εἰπεῖν ἐρωτηθέντα, ὦ Κριτία, σωφροσύνη,
","εἴποιμ᾽ σμικρὰν ὠφελία : ὑγίεια καλός ἔργον ἀπεργάζομαι , ἀποδέχομαι τοῦτο.ἀποδέχομαι.καὶ τοίνυν ἔρομαι οἰκοδομική , ἐπιστήμη οἰκοδομέω , φημί ἔργον ἀπεργάζομαι , εἴποιμ᾽ οἰκάω : ὡσαύτως τέχνη . χρή σωφροσύνη , ἐπεί φημί ἐπιστήμη , ἔχω εἶπον ἐρωτάω , Κριτία , σωφροσύνη , 
"
63,.165e,https://www.perseus.tufts.edu/hopper/xmlchunk?doc=Perseus%3atext%3a1999.01.0175%3atext%3dCharm.%3Asection%3D165e,"ἐπιστήμη οὖσα ἑαυτοῦ, τί καλὸν ἡμῖν ἔργον ἀπεργάζεται καὶ ἄξιον τοῦ ὀνόματος; ἴθι οὖν, εἰπέ.ἀλλ᾽, ὦ Σώκρατες, ἔφη, οὐκ ὀρθῶς ζητεῖς. οὐ γὰρ ὁμοία αὕτη πέφυκεν ταῖς ἄλλαις ἐπιστήμαις, οὐδέ γε αἱ ἄλλαι ἀλλήλαις: σὺ δ᾽ ὡς ὁμοίων οὐσῶν ποιῇ τὴν ζήτησιν. ἐπεὶ λέγε μοι, ἔφη, τῆς λογιστικῆς τέχνης ἢ τῆς γεωμετρικῆς τί ἐστιν τοιοῦτον ἔργον οἷον οἰκία οἰκοδομικῆς ἢ ἱμάτιον ὑφαντικῆς ἢ ἄλλα τοιαῦτ᾽ ἔργα, ἃ πολλὰ ἄν τις ἔχοι πολλῶν τεχνῶν
","ἐπιστήμη , καλός ἔργον ἀπεργάζομαι ἄξιος ὄνομα ; εἶμι , εἰπέ.ἀλλ᾽ , Σώκρατες , φημί , ὀρθός ζητέω . ὅμοιος φύω ἐπιστήμη , ἀλλήλων : δέ ὅμοιος εἰμί ποιέω ζήτησις . ἐπεί λέγω , φημί , λογιστικός τέχνη γεωμετρικός ἔργον οἷος οἰκία οἰκοδομικῆ ἱμάτιον ὑφαντικός τοιαῦτ᾽ ἔργον , πολύς ἔχω πολύς τέχνη 
"
64,.166a,https://www.perseus.tufts.edu/hopper/xmlchunk?doc=Perseus%3atext%3a1999.01.0175%3atext%3dCharm.%3Asection%3D166a,"δεῖξαι; ἔχεις οὖν μοι καὶ σὺ τούτων τοιοῦτόν τι ἔργον δεῖξαι; ἀλλ᾽ οὐχ ἕξεις.καὶ ἐγὼ εἶπον ὅτι ἀληθῆ λέγεις: ἀλλὰ τόδε σοι ἔχω δεῖξαι, τίνος ἐστὶν ἐπιστήμη ἑκάστη τούτων τῶν ἐπιστημῶν, ὃ τυγχάνει ὂν ἄλλο αὐτῆς τῆς ἐπιστήμης. οἷον ἡ λογιστική ἐστίν που τοῦ ἀρτίου καὶ τοῦ περιττοῦ, πλήθους ὅπως ἔχει πρὸς αὑτὰ καὶ πρὸς ἄλληλα: ἦ γάρ;πάνυ γε, ἔφη.οὐκοῦν ἑτέρου ὄντος τοῦ περιττοῦ καὶ ἀρτίου αὐτῆς τῆς λογιστικῆς;πῶς δ᾽ οὔ;
","δείκνυμι ; ἔχω τοιοῦτόνς ἔργον δείκνυμι ; ἀλλ᾽ ἕξεις.καί εἶπον ἀληθής λέγω : ἔχω δείκνυμι , ἐπιστήμη ἕκαστος ἐπιστημῶν , τυγχάνω ἐπιστήμη . οἷος λογιστικός πού ἄρτιος περιττοῦ , πλῆθος ὅπως ἔχω αὑτός ἀλλήλων : γάρ;πάνυ , ἔφη.οὐκοῦν ἕτερος περιττοῦ ἄρτιος λογιστικῆς;πῶς δέ ; 
"
65,.166b,https://www.perseus.tufts.edu/hopper/xmlchunk?doc=Perseus%3atext%3a1999.01.0175%3atext%3dCharm.%3Asection%3D166b,"καὶ μὴν αὖ ἡ στατικὴ τοῦ βαρυτέρου τε καὶ κουφοτέρου σταθμοῦ ἐστιν στατική: ἕτερον δέ ἐστιν τὸ βαρύ τε καὶ κοῦφον τῆς στατικῆς αὐτῆς. συγχωρεῖς;ἔγωγε.λέγε δή, καὶ ἡ σωφροσύνη τίνος ἐστὶν ἐπιστήμη, ὃ τυγχάνει ἕτερον ὂν αὐτῆς τῆς σωφροσύνης;τοῦτό ἐστιν ἐκεῖνο, ἔφη, ὦ Σώκρατες: ἐπ᾽ αὐτὸ ἥκεις ἐρευνῶν τὸ ᾧ διαφέρει πασῶν τῶν ἐπιστημῶν ἡ σωφροσύνη: σὺ δὲ ὁμοιότητά τινα ζητεῖς αὐτῆς ταῖς ἄλλαις. τὸ δ᾽ οὐκ
","μήν αὖ στατικός βαρυτέρου κουφοτέρου σταθμόν στατικός : ἕτερος βαρύς κοῦφος στατικός . συγχωρεῖς;ἔγωγε.λέγε , σωφροσύνη ἐπιστήμη , τυγχάνω ἕτερος σωφροσύνης;τοῦτό ἐκεῖνος , φημί , Σώκρατες : ἐπ᾽ ἥκω ἐρευνάω διαφέρω πᾶς ἐπιστημῶν σωφροσύνη : ὁμοιότητά ζητέω . δέ 
"
66,.166c,https://www.perseus.tufts.edu/hopper/xmlchunk?doc=Perseus%3atext%3a1999.01.0175%3atext%3dCharm.%3Asection%3D166c,"ἔστιν οὕτως, ἀλλ᾽ αἱ μὲν ἄλλαι πᾶσαι ἄλλου εἰσὶν ἐπιστῆμαι, ἑαυτῶν δ᾽ οὔ, ἡ δὲ μόνη τῶν τε ἄλλων ἐπιστημῶν ἐπιστήμη ἐστὶ καὶ αὐτὴ ἑαυτῆς. καὶ ταῦτά σε πολλοῦ δεῖ λεληθέναι, ἀλλὰ γὰρ οἶμαι ὃ ἄρτι οὐκ ἔφησθα ποιεῖν, τοῦτο ποιεῖς: ἐμὲ γὰρ ἐπιχειρεῖς ἐλέγχειν, ἐάσας περὶ οὗ ὁ λόγος ἐστίν.οἷον, ἦν δ᾽ ἐγώ, ποιεῖς ἡγούμενος, εἰ ὅτι μάλιστα σὲ ἐλέγχω, ἄλλου τινὸς ἕνεκα ἐλέγχειν ἢ οὗπερ ἕνεκα κἂν
",", ἀλλ᾽ πᾶς ἐπιστῆμη , δέ , μόνος ἐπιστημῶν ἐπιστήμη . πολύς δεῖ λεληθέναι , οἱόμαι ἄρτι φημί ποιέω , ποιέω : ἐπιχειρέω ἐλέγχω , ἐάω λόγος ἐστίν.οἷος , δέ , ποιέω ἡγέομαι , μάλιστα ἐλέγχω , ἕνεκα ἐλέγχω οὗπερ ἕνεκα 
"
67,.166d,https://www.perseus.tufts.edu/hopper/xmlchunk?doc=Perseus%3atext%3a1999.01.0175%3atext%3dCharm.%3Asection%3D166d,"ἐμαυτὸν διερευνῴμην τί λέγω, φοβούμενος μή ποτε λάθω οἰόμενος μέν τι εἰδέναι, εἰδὼς δὲ μή. καὶ νῦν δὴ οὖν ἔγωγέ φημι τοῦτο ποιεῖν, τὸν λόγον σκοπεῖν μάλιστα μὲν ἐμαυτοῦ ἕνεκα, ἴσως δὲ δὴ καὶ τῶν ἄλλων ἐπιτηδείων: ἢ οὐ κοινὸν οἴει ἀγαθὸν εἶναι σχεδόν τι πᾶσιν ἀνθρώποις, γίγνεσθαι καταφανὲς ἕκαστον τῶν ὄντων ὅπῃ ἔχει;καὶ μάλα, ἦ δ᾽ ὅς, ἔγωγε, ὦ Σώκρατες.θαρρῶν τοίνυν, ἦν δ᾽ ἐγώ, ὦ μακάριε, ἀποκρινόμενος τὸ ἐρωτώμενον ὅπῃ σοι φαίνεται, ἔα χαίρειν εἴτε Κριτίας ἐστὶν
","ἐμαυτοῦ διερευνάομαι λέγω , φοβέω ποτε λάθω οἴομαι οἶδα , οἶδα . νῦν φημί ποιέω , λόγος σκοπέω μάλιστα ἐμαυτοῦ ἕνεκα , ἴσως ἐπιτήδειος : κοινός οἴει ἀγαθός σχεδόν πᾶς ἄνθρωπος , γίγνομαι καταφανής ἕκαστος ὅπη ἔχει;καὶ μάλα , δέ , , Σώκρατες.θαρρῶν τοίνυν , δέ , μακάριος , ἀποκρινόμενος ἐρωτάω ὅπη φαίνω , χαίρω εἴτε κριτίας 
"
68,.166e,https://www.perseus.tufts.edu/hopper/xmlchunk?doc=Perseus%3atext%3a1999.01.0175%3atext%3dCharm.%3Asection%3D166e,"εἴτε Σωκράτης ὁ ἐλεγχόμενος: ἀλλ᾽ αὐτῷ προσέχων τὸν νοῦν τῷ λόγῳ σκόπει ὅπῃ ποτὲ ἐκβήσεται ἐλεγχόμενος.ἀλλά, ἔφη, ποιήσω οὕτω: δοκεῖς γάρ μοι μέτρια λέγειν.λέγε τοίνυν, ἦν δ᾽ ἐγώ, περὶ τῆς σωφροσύνης πῶς λέγεις;λέγω τοίνυν, ἦ δ᾽ ὅς, ὅτι μόνη τῶν ἄλλων ἐπιστημῶν αὐτή τε αὑτῆς ἐστιν καὶ τῶν ἄλλων ἐπιστημῶν ἐπιστήμη.οὐκοῦν, ἦν δ᾽ ἐγώ, καὶ ἀνεπιστημοσύνης ἐπιστήμη ἂν εἴη, εἴπερ καὶ ἐπιστήμης;πάνυ γε, ἔφη.
","εἴτε σωκράτης ἐλέγχω : ἀλλ᾽ προσέχω νόος λόγος σκοπέω ὅπη ποτε ἐκβαίνω ἐλεγχόμενος.ἀλλά , φημί , ποιέω : δοκέω μέτριος λέγειν.λέγω τοίνυν , δέ , σωφροσύνη πῶς λέγεις;λέγω τοίνυν , δέ , μόνος ἐπιστημῶν ἐπιστημῶν ἐπιστήμη.οὐκοῦν , δέ , ἀνεπιστημοσύνη ἐπιστήμη , εἴπερ ἐπιστήμης;πάνυ , φημί . 
"
69,.167a,https://www.perseus.tufts.edu/hopper/xmlchunk?doc=Perseus%3atext%3a1999.01.0175%3atext%3dCharm.%3Asection%3D167a,"ὁ ἄρα σώφρων μόνος αὐτός τε ἑαυτὸν γνώσεται καὶ οἷός τε ἔσται ἐξετάσαι τί τε τυγχάνει εἰδὼς καὶ τί μή, καὶ τοὺς ἄλλους ὡσαύτως δυνατὸς ἔσται ἐπισκοπεῖν τί τις οἶδεν καὶ οἴεται, εἴπερ οἶδεν, καὶ τί αὖ οἴεται μὲν εἰδέναι, οἶδεν δ᾽ οὔ, τῶν δὲ ἄλλων οὐδείς: καὶ ἔστιν δὴ τοῦτο τὸ σωφρονεῖν τε καὶ σωφροσύνη καὶ τὸ ἑαυτὸν αὐτὸν γιγνώσκειν, τὸ εἰδέναι ἅ τε οἶδεν καὶ ἃ μὴ οἶδεν. ἆρα ταῦτά ἐστιν ἃ λέγεις;ἔγωγ᾽, ἔφη.πάλιν τοίνυν, ἦν δ᾽ ἐγώ, τὸ τρίτον τῷ σωτῆρι, ὥσπερ ἐξ
","σώφρων μόνος γιγνώσκω οἷος ἐξετάζω τυγχάνω οἶδα , ὡσαύτως δυνατός ἐπισκοπέω οἶδα οἴομαι , εἴπερ οἶδα , αὖ οἴομαι οἶδα , οἶδα δέ , : σωφρονέω σωφροσύνη γιγνώσκω , οἶδα οἶδα οἶδα . ἆρα λέγεις;ἔγωγ᾽ , ἔφη.πάλιν τοίνυν , δέ , τρίτος σωτήρ , ὥσπερ 
"
