,section,path,text,lemma_text
0,.973a,https://www.perseus.tufts.edu/hopper/xmlchunk?doc=Perseus%3atext%3a1999.01.0179%3atext%3dEpin.%3Asection%3D973a,"πρὸς μὲν τὸ τῆς ὁμολογίας ἥκομεν ἅπαντες ὀρθῶς, ὦ ξένε, τρεῖς ὄντες, ἐγὼ καὶ σὺ καὶ Μέγιλλος ὅδε, τὸ τῆς φρονήσεως ἐπισκεψόμενοι τίνι ποτὲ χρὴ λόγῳ διεξελθεῖν, ὃ τὴν ἀνθρωπίνην ἕξιν φαμέν, ὅταν διανοηθῇ, κάλλιστ᾽ ἔχειν ποιεῖν πρὸς φρόνησιν ὅσην δυνατὸν ἀνθρώπῳ σχεῖν. τὰ μὲν
","ὁμολογία ἥκω ἅπας ὀρθός , ξένος , τρεῖς , Μέγιλλος , φρονήσεως ἐπισκεψόμενοι ποτε χρή λόγος διεξέρχομαι , ἀνθρωπίνην ἕξις φαμέν , ὅταν διανοέω , κάλλιστ᾽ ἔχω ποιέω φρόνησις ὅσος δυνατός ἄνθρωπος ἔχω . 
"
1,.973b,https://www.perseus.tufts.edu/hopper/xmlchunk?doc=Perseus%3atext%3a1999.01.0179%3atext%3dEpin.%3Asection%3D973b,"γὰρ ἄλλα, ὥς φαμεν, ἅπαντα διεξήλθομεν ὅσα ἦν περὶ νόμων θέσιν: ὃ δὲ μέγιστον εὑρεῖν τε καὶ εἰπεῖν, τί ποτε μαθὼν θνητὸς ἄνθρωπος σοφὸς ἂν εἴη, τοῦτο οὔτε εἴπομεν οὔτε ηὕρομεν, νῦν τε πειρώμεθα τοῦτο μὴ καταλιπεῖν: σχεδὸν γὰρ ἀτελὲς ἂν πράξαιμεν οὗ χάριν ἅπαντες ὡρμήσαμεν, ὡς φανερὰ ποιήσοντες ἐξ ἀρχῆς μέχρι τέλους. ὦ φίλε Κλεινία, καλῶς μὲν λέγεις, ἄτοπον μὴν ἀκούσεσθαί σε λόγον οἶμαι, καί τινα τρόπον οὐκ ἄτοπον αὖ.
",", φημί , ἅπας διεξέρχομαι ὅσος νόμος θέσις : μέγας εὑρίσκω εἶπον , ποτε μανθάνω θνητός ἄνθρωπος σοφός , εἴπω ηὕρομεν , νῦν πειράω καταλιμπάνω : σχεδόν ἀτελής πράσσω χάρις ἅπας ὡρμήω , φανερός ποιέω ἀρχή μέχρι τέλος . φίλος Κλεινία , καλός λέγω , ἄτοπος μήν ἀκούσεσθαί λόγος οἱόμαι , τρόπος ἄτοπος αὖ . 
"
2,.973c,https://www.perseus.tufts.edu/hopper/xmlchunk?doc=Perseus%3atext%3a1999.01.0179%3atext%3dEpin.%3Asection%3D973c,"πολλοὶ γὰρ δὴ προστυχεῖς τῷ βίῳ γιγνόμενοι τὸν αὐτὸν λόγον φέρουσιν, ὡς οὐκ ἔσται μακάριον τὸ τῶν ἀνθρώπων γένος οὐδ᾽ εὔδαιμον. ἕπου δὴ καὶ σύνιδε ἄν σοι δοκῶ κἀγὼ μετ᾽ αὐτῶν καλῶς τοῦ τοιούτου πέρι λέγειν. οὔ φημι εἶναι δυνατὸν ἀνθρώποις μακαρίοις τε καὶ εὐδαίμοσιν γενέσθαι πλὴν ὀλίγων— μέχριπερ ἂν ζῶμεν τοῦτο διορίζομαι: καλὴ δὲ ἐλπὶς τελευτήσαντι τυχεῖν ἁπάντων ὧν ἕνεκά τις προθυμοῖτ᾽ ἂν ζῶν τε ὡς κάλλιστ᾽ ἂν ζῆν κατὰ δύναμιν καὶ τελευτήσας τελευτῆς
","πολύς προστυχής βίος γίγνομαι λόγος φέρω , μακάριος ἄνθρωπος γένος οὐδέ εὔδαιμος . ἕπου σύνιδε δοκέω ἐκἀ ἐγὼ μετ᾽ καλός λέγω . φημί δυνατός ἄνθρωπος μακαρίοις εὐδαίμος γίγνομαι πλήν ὀλίγος — μέχριπερ ζῶ διορίζω : καλός ἐλπίς τελευτάω τυγχάνω ἅπας ἕνεκα προθυμοῖτ᾽ ζάω κάλλιστ᾽ ζῶ δύναμις τελευτάω τελευτή 
"
3,.973d,https://www.perseus.tufts.edu/hopper/xmlchunk?doc=Perseus%3atext%3a1999.01.0179%3atext%3dEpin.%3Asection%3D973d,"τοιαύτης τυχεῖν—λέγω δ᾽ οὐδὲν σοφόν, ἀλλ᾽ ὅπερ ἅπαντες Ἕλληνές τε καὶ βάρβαροι γιγνώσκομέν τινα τρόπον, ὡς ἐξ ἀρχῆς τὸ γενέσθαι χαλεπὸν ἅπαντι ζῴῳ: πρῶτον μὲν τὸ μετασχεῖν τῆς τῶν κυουμένων ἕξεως, ἔπειτ᾽ αὖ τὸ γίγνεσθαι, καὶ ἔτι τὸ τρέφεσθαι καὶ παιδεύεσθαι, διὰ πόνων μυρίων
","τυγχάνω — λέγω δέ σοφός , ἀλλ᾽ ὅσπερ ἅπας ἕλλην βάρβαρος γιγνώσκομέν τρόπος , ἀρχή γίγνομαι χαλεπός ἅπαντι ζῴῳ : πρῶτος μετέχω κυέω ἕξεως , ἔπειτ᾽ αὖ γίγνομαι , τρέφω παιδεύω , πόνος μυρίος 
"
4,.974a,https://www.perseus.tufts.edu/hopper/xmlchunk?doc=Perseus%3atext%3a1999.01.0179%3atext%3dEpin.%3Asection%3D974a,"ταῦτα γίγνεσθαι σύμπαντα, ὥς φαμεν ἅπαντες. καὶ χρόνος βραχὺς ἄν τις εἴη πρὸς λογισμὸν μή τοι τῶν μοχθηρῶν, ἀλλ᾽ ὃ πᾶς ἂν ὑπολάβοι μέτριον. οὗτος δὲ σχεδὸν ἀναπνοὴν δοκεῖ ποιεῖν τινα κατὰ μέσον πῃ βίον τὸν ἀνθρώπινον: ταχύ γε μὴν ἐπιλαβὸν γῆρας ὁντινοῦν ποιήσει᾽ ἂν μήποτ᾽ ἐθελῆσαι πάλιν ἀναβιῶναι, λογισάμενον τὸν βεβιωμένον ἑαυτῷ βίον, ὅστις μὴ τυγχάνει παιδικῆς δόξης μεστὸς ὤν. τούτων δὴ τί ποτέ μοι τεκμήριον; ὅτι πέφυκεν ταύτῃ τὸ νῦν ζητούμενον
","γίγνομαι σύμπας , φημί ἅπας . χρόνος βραχύς λογισμὸς μοχθηρός , ἀλλ᾽ πᾶς ὑπολαμβάνω μέτριος . σχεδόν ἀναπνοὴ δοκέω ποιέω μέσος πη βίος ἀνθρώπινος : ταχύς μήν ἐπιλαβὸν γῆρας ὁντινοῦς ποιήσει᾽ μήποτ᾽ ἐθέλω πάλιν ἀναβιῶναι , λογίζομαι βεβιωμένον βίος , τυγχάνω παιδικῆς δόξα μεστὸς . ποτε τεκμήριον ; φύω νῦν ζητέω 
"
5,.974b,https://www.perseus.tufts.edu/hopper/xmlchunk?doc=Perseus%3atext%3a1999.01.0179%3atext%3dEpin.%3Asection%3D974b,"τῷ λόγῳ. ζητοῦμεν δὲ δὴ τίνα τρόπον σοφοὶ γενησόμεθα, ὡς οὔσης τινὸς ἑκάστοις ταύτης τῆς δυνάμεως: ἡ δὲ φυγῇ φεύγει τότε ὅταν τις πρός τινα φρόνησιν ἴῃ τῶν λεγομένων τεχνῶν ἢ φρονήσεων ἤ τινων ἄλλων τοιούτων ὡς οἰόμεθα ἐπιστημῶν, ὡς ἀξίας τούτων οὐδεμιᾶς οὔσης ἐπίκλησιν ῥηθῆναι τῆς περὶ ταῦτα σοφίας τἀνθρώπινα, τῆς δὲ ψυχῆς σφόδρα πεποιθυίας καὶ μαντευομένης ὡς οὔσης αὐτῇ κατά
","λόγος . ζητέω τρόπος σοφός γενησόμεθα , ἕκαστος δύναμις : φυγή φεύγω τότε ὅταν φρόνησις εἶμι λέγω τέχνη φρονήσεων οἴομαι ἐπιστημῶν , ἄξιος οὐδεμιᾶς ἐπίκλησις ῥηθῆναι σοφία τἀνθρώπινος , ψυχή σφόδρα πεποιθυία μαντέυω 
"
6,.974c,https://www.perseus.tufts.edu/hopper/xmlchunk?doc=Perseus%3atext%3a1999.01.0179%3atext%3dEpin.%3Asection%3D974c,"τινα φύσιν ταύτης, τίς δέ ἐστιν καὶ πότε καὶ πῶς, οὐ πάνυ δυναμένης ἐξευρίσκειν. ἆρ᾽ οὐ τούτῳ σφόδρα προσέοιχ᾽ ἡμῶν ἡ περὶ σοφίαν ἀπορία καὶ ζήτησις, πλείων τῆς ἐλπίδος ἑκάστῳ γιγνομένη τῶν ὅσοι ἐν ἡμῖν δυνατοὶ γίγνονται φρονίμως αὑτοὺς ἄλλους τε ἐξετάσαι συμφώνως διὰ λόγων πάντων καὶ πάντῃ λεγομένων; ταῦτα οὐχ οὕτως ἢ ταύτῃ συμφήσομεν ἔχειν; συμφήσομεν ἐπ᾽ ἐλπίδι σοι ἴσως ταῦτ᾽, ὦ ξένε, τῇ
","φύσις , πότε πῶς , πάνυ δυναμένης ἐξευρίσκω . ἆρ᾽ σφόδρα προσέοιχ᾽ σοφία ἀπορία ζήτησις , πλείων ἐλπίς ἕκαστος γίγγνομαι ὅσος δυνατός γίγνομαι φρονίμως ἐξετάζω συμφώνως λόγος πᾶς πάντῃ λέγω ; συμφίημι ἔχω ; συμφέω ἐπ᾽ ἐλπίς ἴσως ταῦτ᾽ , ξένος , 
"
7,.974d,https://www.perseus.tufts.edu/hopper/xmlchunk?doc=Perseus%3atext%3a1999.01.0179%3atext%3dEpin.%3Asection%3D974d,"μετὰ σοῦ κατὰ χρόνον ἂν γενομένῃ, δοξάσαι περὶ αὐτῶν εἰς αὖθις τὸ ἀληθέστατον. τὰς ἄλλας τοίνυν ὅσαι ἐπιστῆμαι μέν εἰσιν λεγόμεναι, σοφὸν δὲ οὐκ ἀποτελοῦσιν τὸν λαμβάνοντά τε αὐτὰς καὶ ἔχοντα, πρῶτον διεξιτέον, ὅπως ταύτας ἐκποδὼν θέμενοι, πειρώμεθα ἐκείνας ὧν δεόμεθα παραθέσθαι τε καὶ παραθέμενοι μανθάνειν.πρῶτον μὲν τοίνυν ὧν πρῶτον δεῖ θνητῷ γένει, ἴδωμεν
","χρόνος γίγνομαι , δοξάζω αὖθις ἀληθής . τοίνυν ὅσος ἐπιστῆμη λέγω , σοφός ἀποτελέω λαμβάνω ἔχω , πρῶτος διεξιτέος , ὅπως ἐκποδών τίθημι , πειρέω ἐκεῖνος δέω παρατίθημι παρατίθημι μανθάνειν.πρῶτον τοίνυν πρῶτος δεῖ θνητός γένος , ὁράω 
"
8,.974e,https://www.perseus.tufts.edu/hopper/xmlchunk?doc=Perseus%3atext%3a1999.01.0179%3atext%3dEpin.%3Asection%3D974e,"ὡς εἰσὶ μὲν ἀναγκαιόταται σχεδὸν ἀληθῶς τε πρῶται, ὁ δὲ ἐπιστήμων αὐτῶν γιγνόμενος, εἰ καὶ κατ᾽ ἀρχὰς ἔδοξέν τις εἶναί ποτε σοφός, οὔκουν νῦν γε οὔτε σοφὸς εἶναι δοξάζεται
","ἀναγκαιόταται σχεδόν ἀληθῶς πρῶτος , ἐπιστήμων γιγνόμενος , κατ᾽ ἀρχή ἔδοξέν ποτε σοφός , οὔκουν νῦν σοφός δοξάζω 
"
9,.975a,https://www.perseus.tufts.edu/hopper/xmlchunk?doc=Perseus%3atext%3a1999.01.0179%3atext%3dEpin.%3Asection%3D975a,"ὀνείδη τε ἴσχει μᾶλλον ἀπὸ τῆς τοιαύτης ἐπιστήμης. ἐροῦμεν δὴ αἵ τ᾽ εἰσὶν καὶ ὅτι πᾶς ἀνὴρ αὐτάς, σχεδὸν ὅσοις ἀγὼν πρόκειται τοῦ δοκεῖν ὡς ἄριστον ἄνδρα συμβῆναι γενόμενον ἄν, φεύγει διὰ τὰς κτήσεις τῆς φρονήσεώς τε καὶ ἐπιτηδεύσεως. ἔστω δὴ πρῶτον μὲν ἡ τῆς ἀλληλοφαγίας τῶν ζῴων ἡμᾶς τῶν μέν, ὡς ὁ μῦθός ἐστιν, τὸ παράπαν ἀποστήσασα, τῶν δὲ εἰς τὴν νόμιμον ἐδωδὴν καταστήσασα. ἵλεῳ δ᾽ ἡμῖν οἱ πρόσθεν εἴησάν τε καὶ εἰσίν—οἵτινες μὲν
","ὄνειδος ἴσχω μᾶλλον ἐπιστήμη . λέγω τ᾽ πᾶς ἀνήρ , σχεδόν ὅσος ἀγών πρόκειμαι δοκέω ἄριστος ἀνήρ συμβαίνω γίγνομαι , φεύγω κτῆσις φρονήσεώς ἐπιτηδεύσεως . πρῶτος ἀλληλοφαγία ζῴον , μῦθός , παράπαν ἀποστέω , νόμιμος ἐδωδή καταστέω . ἴλαος δέ πρόσθεν εἴησάν — 
"
10,.975b,https://www.perseus.tufts.edu/hopper/xmlchunk?doc=Perseus%3atext%3a1999.01.0179%3atext%3dEpin.%3Asection%3D975b,"γὰρ οὖν† ἐλέγομεν, πρῶτοι χαιρέτωσαν—ἡ δ᾽ οὖν ἀλφίτων τε καὶ ἀλεύρων ποίησις ἅμα καὶ τροφὴ καλὴ μὲν καὶ ἀγαθή, σοφὸν δὲ ἄνδρα τελέως οὐκ ἐθελήσει ποτὲ ἀπεργάσασθαι: τοῦτο γὰρ αὐτό, ἡ τῆς ποιήσεως ἐπίκλησις, τῶν ποιουμένων αὐτῶν δυσχέρειαν ἀπεργάζοιτ᾽ ἄν. σχεδὸν δ᾽ οὐδὲ χώρας συμπάσης γεωργία: οὐ γὰρ τέχνῃ ἀλλὰ φύσει κατὰ θεὸν πάντες φαινόμεθα γῆν μετακεχειρίσθαι. καὶ μὴν οὐδ᾽ ἡ τῶν οἰκήσεών γε συνυφὴ καὶ σύμπασα οἰκοδομία καὶ σκευῶν
","† ἐλέγω , πρῶτος χαιρέω — δέ ἄλφιτον ἀλεύρων ποίησις ἅμα τροφή καλός ἀγαθός , σοφός ἀνήρ τέλειος ἐθέλω ποτε ἀπεργάζομαι : , ποίησις ἐπίκλησις , ποιέω δυσχέρειη ἀπεργάζοιτ᾽ . σχεδόν δέ χώρα συμπάσης γεωργία : τέχνη φύσις θεός πᾶς φαινόμεθα γῆ μετακεχειρίσθαι . μήν οὐδέ οἰκήσεών συνυφὴ σύμπας οἰκοδομία σκευόν 
"
11,.975c,https://www.perseus.tufts.edu/hopper/xmlchunk?doc=Perseus%3atext%3a1999.01.0179%3atext%3dEpin.%3Asection%3D975c,"πάντων ἀπεργαστική, χαλκεία τε καὶ ἡ τῶν τεκτονικῶν καὶ πλαστικῶν καὶ πλεκτικῶν καὶ ἔτι συμπάντων ὀργάνων παρασκευή, δήμῳ τὸ πρόσφορον ἔχουσα, ἀλλ᾽ οὐκ ἐπ᾽ ἀρετῇ λεγομένη. καὶ μὴν οὐδ᾽ ἡ σύμπασα θηρευτική, πολλή περ καὶ τεχνικὴ γεγονυῖα, τό γε μεγαλοπρεπὲς σὺν τῷ σοφῷ οὐκ ἀποδίδωσιν. οὐ μὴν οὐδὲ μαντική γε οὐδ᾽ ἑρμηνευτικὴ τὸ παράπαν: τὸ λεγόμενον γὰρ οἶδεν μόνον, εἰ δ᾽ ἀληθές, οὐκ ἔμαθεν.ὅτε δὴ τὴν τῶν ἀναγκαίων ὁρῶμεν κτῆσιν διὰ τέχνης μὲν
","πᾶς ἀπεργαστική , χαλκεία τεκτονικός πλαστικῶν πλεκτικός σύμπας ὀργάνον παρασκευή , δῆμος πρόσφορος ἔχω , ἀλλ᾽ ἐπ᾽ ἀρετή λέγω . μήν οὐδέ σύμπας θηρευτικός , πολύς πέρ τεχνικός γίγνομαι , μεγαλοπρεπής σοφός ἀποδίδωμι . μήν μαντικός οὐδέ ἑρμηνευτικός παράπαν : λέγω οἶδα μόνος , δέ ἀληθής , ἔμαθεν.ὅτε ἀναγκαίος ὁράω κτῆσις τέχνη 
"
12,.975d,https://www.perseus.tufts.edu/hopper/xmlchunk?doc=Perseus%3atext%3a1999.01.0179%3atext%3dEpin.%3Asection%3D975d,"ἀπεργαζομένην, τούτων δὲ οὐδεμίαν οὐδένα σοφὸν ποιοῦσαν, τό γε μετὰ τοῦτο παιδιά τις ἂν λείποιτο, μιμητικὴ μὲν τὸ πλεῖστον ἀλλ᾽ οὐδαμῇ σπουδαία. πολλοῖς μὲν γὰρ ὀργάνοις μιμοῦνται, πολλοῖς δ᾽ αὐτῶν τῶν σωμάτων οὐ πάντως εὐσχήμοσι μιμήμασιν, τά τε κατὰ λόγους καὶ μοῦσαν πᾶσαν, καὶ ὅσων γραφικὴ μήτηρ, πολλῶν καὶ παντοίων ποικιλμάτων ἀποτελουμένων ἐν πολλοῖς ὑγροῖς καὶ ξηροῖς γένεσιν: ὧν σοφὸν οὐδένα εἰς οὐδὲν σπουδῇ τῇ μεγίστῃ δημιουργοῦντα ἡ μιμητικὴ παρέχεται.
","ἀπεργαζομένην , σοφός ποιέω , παιδιον λείπω , μιμητικός πλεῖστος ἀλλ᾽ οὐδαμῇ σπουδαία . πολύς ὀργάνον μιμόω , πολύς δέ σῶμα πάντως εὐσχήμων μιμήμα , λόγος μοῦσαν πᾶς , ὅσος γραφικός μήτηρ , πολύς παντοῖος ποικιάμλτος ἀποτελέω πολύς ὑγρός ξηρός γένος : σοφός σπουδή μέγας δημιουργέω μιμητικός παρέχω . 
"
13,.975e,https://www.perseus.tufts.edu/hopper/xmlchunk?doc=Perseus%3atext%3a1999.01.0179%3atext%3dEpin.%3Asection%3D975e,"πάντων δ᾽ ἐξειργασμένων τὸ λοιπὸν βοήθεια γίγνοιτ᾽ ἂν μυρία μυρίοις, ἡ μὲν μεγίστη τε καὶ εἰς πλεῖστα πολεμικὴ κληθεῖσα, στρατηγικὴ τέχνη, εὐδοκιμωτάτη πρὸς χρείαν, εὐτυχίας πλείστης δεομένη, μᾶλλον δὲ ἀνδρείᾳ κατὰ φύσιν ἢ
","πᾶς δέ ἐξειργάζομαι λοιπός βοήθεια γίγνοιτ᾽ μυρίος μυρίος , μέγας πολύς πολεμικός κλέω , στρατηγικός τέχνη , εὐδοκιμωτάτη χρεία , εὐτυχία πλερός δέω , μᾶλλον ἀνδρεία φύσις 
"
14,.976a,https://www.perseus.tufts.edu/hopper/xmlchunk?doc=Perseus%3atext%3a1999.01.0179%3atext%3dEpin.%3Asection%3D976a,"σοφίᾳ δεδομένη. ἣν δὲ καλοῦσι μὲν ἰατρικήν, βοήθεια δέ που καὶ αὕτη σχεδὸν ὅσων ὧραι ψύχει καὶ καύματι ἀκαίρῳ καὶ πᾶσι τοῖς τοιούτοις ληίζονται τὴν τῶν ζῴων φύσιν. εὐδόκιμον δὲ οὐδὲν τούτων εἰς σοφίαν τὴν ἀληθεστάτην: ἄμετρα γὰρ δόξαις φορεῖται τοπαζόμενα. βοηθοὺς δέ που καὶ τοὺς κυβερνήτας ἅμα καὶ τοὺς ναύτας ἐροῦμεν, καὶ τούτων ἄνδρα σοφὸν μηδένα τις ἡμᾶς παραμυθούμενος ἐξ ἁπάντων διαγγελλέτω: οὐ γὰρ ἂν εἰδείη τις πνεύματος ὀργὴν
","σοφία δεδομένη . καλέω ἰατρική , βοήθεια πού σχεδόν ὅσος ὥρα ψῦχος καῦμα ἀκαίρος πᾶς ληίζω ζῴον φύσις . εὐδόκιμος σοφία ἀληθής : ἄμετρος δόξη φορέω τοπαζόμενα . βοηθόος πού κυβερνήτης ἅμα ναύτης λέγω , ἀνήρ σοφός μηδείς παραμυθέομαι ἅπας διαγγελλέτω : οἶδα πνεῦμα ὀργή 
"
15,.976b,https://www.perseus.tufts.edu/hopper/xmlchunk?doc=Perseus%3atext%3a1999.01.0179%3atext%3dEpin.%3Asection%3D976b,"οὐδὲ φιλίαν, ὃ προσφιλὲς ἁπάσῃ κυβερνητικῇ. καὶ μὴν οὐδ᾽ ὁπόσοι βοηθοὶ δίκαις ἐν τῇ τοῦ λέγειν ῥώμῃ φασὶ γίγνεσθαι, μνήμῃ καὶ τριβῇ δόξης ἤθεσιν προσέχοντες τὸν νοῦν, ἀληθείας δὲ τῶν ὄντως δικαίων ἐκτὸς παρεσφαλμένοι.λοιπὴ δ᾽ ἔτι πρὸς δόξαν σοφίας ἐστίν τις ἄτοπος δύναμις, ἣν φύσιν ἂν οἱ πολλοὶ μᾶλλον ἢ σοφίαν ὀνομάσειαν, τότε ὅταν τινά τις συννοῇ ῥᾳδίως μὲν ὅτιπερ ἂν μανθάνῃ μανθάνοντα,
","φιλία , προσφιλής ἅπας κυβερνητικός . μήν οὐδέ ὁπόσος βοηθοὶ δίκη λέγω ῥώμη φημί γίγνομαι , μνήμη τριβή δόξα ἦθος προσέχω νόος , ἀλήθεια ὄντως δίκαιος ἐκτός παρεσφαλμένοι.λοιπός δέ δόξα σοφία ἄτοπος δύναμις , φύσις πολύς μᾶλλον σοφία ὀνομάσειαν , τότε ὅταν συννοέω ῥᾴδιος ὅτιπερ μανθάνω μανθάνω , 
"
16,.976c,https://www.perseus.tufts.edu/hopper/xmlchunk?doc=Perseus%3atext%3a1999.01.0179%3atext%3dEpin.%3Asection%3D976c,"μάλα δὲ πολλὰ καὶ ἀσφαλῶς μνημονεύοντα, ὅταν τε τὸ πρόσφορον ἑκάστῳ διαμνημονεύῃ τις, ὅτι γιγνόμενον ἂν πρέποι, τοῦτο δὲ ταχὺ δρᾷ: ταῦτα γὰρ ἅπαντα οἱ μὲν φύσιν, οἱ δὲ σοφίαν, οἱ δὲ ἀγχίνοιαν θήσουσιν φύσεως, σοφὸν δὲ ὄντως οὐδενὶ τούτων οὐδεὶς τῶν ἐμφρόνων ἐθελήσει ποτὲ καλεῖν.ἀλλὰ μὴν δεῖ φανῆναί γέ τινα ἐπιστήμην ἣν ἔχων σοφὸς γίγνοιτ᾽ ἂν ὁ σοφὸς ὄντως ὢν καὶ μὴ μόνον δοξαζόμενος. ἴδωμεν δή. χαλεπῷ μὲν γὰρ λόγῳ παντάπασιν
","μάλα πολύς ἀσφαλής μνημονεύω , ὅταν πρόσφορος ἕκαστος διαμνημονεύω , γίγνομαι πρέπω , ταχύς δράω : ἅπας φύσις , σοφία , ἀγχίνοια ἵθημι φύσις , σοφός ὄντως ἐμφρόνων ἐθέλω ποτέ καλεῖν.ἀλλὰ μήν δεῖ φαίνω ἐπιστήμη ἔχω σοφός γίγνοιτ᾽ σοφός ὄντως μόνος δοξάζω . ὁράω . χαλεπός λόγος παντάπασι 
"
17,.976d,https://www.perseus.tufts.edu/hopper/xmlchunk?doc=Perseus%3atext%3a1999.01.0179%3atext%3dEpin.%3Asection%3D976d,"ἐπιχειροῦμεν, ἑτέραν πάρεξ τῶν εἰρημένων εὑρεῖν, ἣ σοφία μὲν λέγοιτ᾽ ἂν ὄντως τε καὶ εἰκότως, ὁ δὲ λαβὼν οὔτε βάναυσος οὔτ᾽ ἠλίθιος ἔσται, σοφὸς δὲ καὶ ἀγαθὸς δι᾽ αὐτὴν πολίτης τε καὶ ἄρχων καὶ ἀρχόμενος ἐνδίκως ἔσται πόλεως ἅμα καὶ ἐμμελής. κατίδωμεν δὴ ταύτην πρώτην, τίς ποτ᾽ ἐκ τῆς ἀνθρωπίνης φύσεως ἐπιστήμη μία διεξελθοῦσα ἢ μὴ παραγενομένη τῶν νῦν παρουσῶν ἀνοητότατον ἂν καὶ ἀφρονέστατον παράσχοιτο ζῷον τὸ τῶν ἀνθρώπων. οὐ δὴ
","ἐπιχειρέω , ἕτερος παρέξ ἐρῶ εὑρίσκω , σοφία λέγοιτ᾽ ὄντως εἰκότως , λαμβάνω βάναυσος οὔτ᾽ ἠλίθιος , σοφός ἀγαθός δι᾽ πολίτης ἄρχων ἄρχω ἔνδικος πόλις ἅμα ἐμμελής . κατίδεωμι πρῶτος , ποτ᾽ ἀνθρώπινος φύσις ἐπιστήμη εἷς διεξέρχομαι παραγενομένη νῦν πάρειμι ἀνοητός ἀφρονέσς παράσχοιτο ζώιον ἄνθρωπος . 
"
18,.976e,https://www.perseus.tufts.edu/hopper/xmlchunk?doc=Perseus%3atext%3a1999.01.0179%3atext%3dEpin.%3Asection%3D976e,"τοῦτό γε πάνυ χαλεπὸν τὸ κατιδεῖν. μία γὰρ ὡς εἰπεῖν πρὸς μίαν ἡ τὸν ἀριθμὸν δοῦσα παντὶ τῷ θνητῷ γένει τοῦτ᾽ ἂν δράσειεν: θεὸν δ᾽ αὐτὸν μᾶλλον ἤ τινα τύχην ἡγοῦμαι δόντα ἡμῖν σῴζειν ἡμᾶς. ὃν δὲ θεὸν ἡγοῦμαι, φράζειν χρή, καίπερ ἄτοπον ὄντα, καί πως οὐκ ἄτοπον αὖ: πῶς γὰρ τὸ
","πάνυ χαλεπός κατεῖδον . εἷς εἶπον εἷς ἀριθμός δίδωμι πᾶς θνητός γένος τοῦτ᾽ δράσειω : θεός δέ μᾶλλον τύχη ἡγέομαι δίδωμι σῴζω . θεός ἡγέομαι , φράζω χρή , καίπερ ἄτοπος , οὔπως ἄτοπος αὖ : πῶς 
"
